{
  "title": "2026 3분기 제품 로드맵 회의",
  "date": "2026-07-16 14:00",
  "attendees": ["김수민", "이정우", "박서연"],
  "discussion": [
    {
      "topic": "STT 연동 우선순위",
      "points": ["실시간 STT는 3분기 범위에서 제외", "배치 STT부터 도입하기로 의견 수렴"]
    },
    {
      "topic": "출력 포맷",
      "points": ["Markdown 미리보기 후 docx 확정 흐름 확인"]
    }
  ],
  "decisions": ["docx 변환은 python-docx로 진행", "STT는 입력 어댑터 자리만 우선 확보"],
  "action_items": [
    { "task": "python-docx 렌더러 PoC 작성", "owner": "이정우", "due": "2026-07-23" },
    { "task": "샘플 회의 원문 수집", "owner": "박서연", "due": null }
  ],
  "next_meeting": "2026-07-23 14:00"
}
